{"meta":{"eventId":"c3a2b1d0-1e2f-4a5b-8c7d-9e0f1a2b3c4d","occurredAt":"2026-10-01T10:05:00Z","producer":"ledger","correlationId":"reconciliation"},"mismatchId":"d4d4d4d4-0000-4000-8000-000000000001","reconciliationRunId":"f5f5f5f5-0000-4000-8000-000000000001","paymentId":"a0a0a0a0-0000-3000-8000-000000000001","kind":"AMOUNT_MISMATCH","ledgerAmount":{"atomicUnits":25000,"asset":"USDC","decimals":6},"chainAmount":{"atomicUnits":20000,"asset":"USDC","decimals":6},"reportedTxHash":"0x68592d03715426a9a3aea48c4f50df430e6e10ad46962d9ab0c7c532a73bb090","chainTxHash":"0x68592d03715426a9a3aea48c4f50df430e6e10ad46962d9ab0c7c532a73bb090","adjustmentEntryId":"e1e2e3e4-0000-4000-8000-000000000002"}
